{
    "$schema": "http://json-schema.org/draft-07/schema#",
    "title": "SwiftyEdit Registry Entry",
    "type": "object",
    "required": [
        "slug",
        "name",
        "type",
        "author",
        "repo",
        "description"
    ],
    "properties": {
        "slug": {
            "type": "string",
            "pattern": "^[A-Za-z0-9]+(-[A-Za-z0-9]+)*$"
        },
        "name": {
            "type": "string",
            "minLength": 1
        },
        "type": {
            "type": "string",
            "enum": ["plugin", "theme"]
        },
        "author": {
            "type": "string",
            "minLength": 1
        },
        "repo": {
            "type": "string",
            "format": "uri",
            "pattern": "^https://github\\.com/"
        },
        "description": {
            "type": "string",
            "minLength": 1,
            "maxLength": 300
        },
        "homepage": {
            "type": "object",
            "propertyNames": {
                "pattern": "^[a-z]{2}$"
            },
            "additionalProperties": {
                "type": "string",
                "format": "uri",
                "pattern": "^https://"
            },
            "minProperties": 1
        },
        "tags": {
            "type": "array",
            "items": {
                "type": "string"
            },
            "maxItems": 10
        },
        "screenshots": {
            "type": "array",
            "items": {
                "type": "string",
                "format": "uri",
                "pattern": "^https://"
            },
            "maxItems": 6
        }
    },
    "additionalProperties": false
}
